Date,Location,Incident Type,Victim Details,Circumstances,Source,Site
Sep 2025 (monsoon onset),"Inside Reef, Hikkaduwa",Marine Life Encounter (Jellyfish Sting),"Group of intermediates (tourists, ages 20s)",Tentacle contact with drifting jellyfish in flat conditions; welts and rash; purple flag warnings for marine life.,AP News Rip/Jellyfish Hazards; Surf Atlas,Hikkaduwa
10-Feb,Hikkaduwa Beach,Environmental Hazard (Rip Current/Near-Drowning),Three Russian female tourists (ages 33/40/43),Caught in powerful rip current while swimming in the evening; rescued by Hikkaduwa Police Lifesaving Unit; no injuries reported  but highlighted evening current risks.,Newswire Sri Lanka,Hikkaduwa
7-Feb,Hikkaduwa Beach,Environmental Hazard (Rip Current/Near-Drowning),Russian woman (age 68),Swept out by strong currents during evening swim; rescued by police lifeguards; received on-site first aid for exhaustion; common in post-sunset low-visibility conditions.,Newswire Sri Lanka,Hikkaduwa
6-Apr,"Pannamgoda Sea, Hikkaduwa",Environmental Hazard (Rip Current/Near-Drowning),Russian woman (age 29),Pulled offshore while bathing; rescued by two Hikkaduwa Police Lifeguard Unit officers; treated for minor water inhalation; emphasized need for buddy system in flagged areas.,Newswire Sri Lanka,Hikkaduwa
25-Dec,"Dhodanduwa Area, Hikkaduwa",Wipeout/Drowning,Indian man (age 57) and daughter (age unspecified),Swept away by sudden strong waves during sea bathing; daughter rescued by locals but father drowned en route to Karapitiya Hospital; part of a 24-hour cluster of 6 incidents (5 rescues  1 death).,Newswire Sri Lanka,Hikkaduwa
26-Feb,"Narigama Beach,Hikkaduwa",Environmental Hazard (Rip Current/Near-Drowning),Russian girl (age 13),Swept away by strong currents while swimming; rescued by team of Hikkaduwa Police Life-Saving Unit (Sub-Inspector Deshapriya and Constables Duminda/Kanishka/Kumara/Dissanayake/Jayasinghe); initial medical aid provided on-site.,Newswire Sri Lanka,Hikkaduwa
17-Jan,Hikkaduwa Beach (general),Wipeout/Drowning,Foreign man (Mark Shehan Herath),Drowned during sea bath; body recovered by Hikkaduwa Police; no further details on currents or supervision; part of early 2025 spike in tourist drownings.,Daily News Sri Lanka,Hikkaduwa
2013 (approx., Hikkaduwa,Marine Life Encounter (Jellyfish Sting),Unspecified tourist (likely swimmer/surfer),Stung by Portuguese Man o' War (Physalia physalis) with 1.5m tentacle; initial freshwater rinse worsened pain and caused breathing difficulty; hospitalized for treatment; locals unaware of proper seawater/vinegar protocol.,TripAdvisor Hikkaduwa Forum,Hikkaduwa
8-Mar,Hikkaduwa Beach (ex-cyclone conditions),Environmental Hazard (Rip Current/Near-Drowning),Two unspecified locals (ages unspecified),Entered rough post-cyclone surf for swim; swept 300m offshore; self-rescued but fined heavily (~$16 000 AUD equivalent) by police for ignoring warnings; no injuries  but underscored cyclone season dangers.,X Post by @FeathersMcGee,Hikkaduwa
18-Sep,Mirissa Beach (near Hikkaduwa),Environmental Hazard (Rip Current/Near-Drowning),Austrian female tourist (age unspecified),Swept away by sea currents while bathing; rescued by police lifesaving team with first aid; no relation to surfing but similar conditions; prompted beach safety tips (e.g swim in flagged areas avoid alcohol).,X Post by @SriLankaTweet,Hikkaduwa
Ongoing (2020 to 2025),"Benny's Reef, Hikkaduwa",Environmental Hazard (Reef Cuts),Experienced surfers (tourists/locals,Lacerations from shallow coral during wipeouts in 6–10ft swells; infections common without booties; treated with vinegar and irrigation; deeper reef but urchins pose puncture risks.,Surf South Sri Lanka Guide; Surf Atlas,Hikkaduwa
Jan to Jul 2025,Hikkaduwa Beach (among SW coast sites),Wipeout/Drowning,250+ total (mix of locals/tourists  including surfers/swimmers),Drownings from rips  strong waves  and wipeouts; many preventable via flags/infrastructure; government red tape blocks hotel safety measures; Hikkaduwa contributes significantly to total.,Ada Derana News; X Post by @sonaljay8,Hikkaduwa
20-Oct,"Main Reef, Hikkaduwa",Environmental Hazard (Reef Cuts/Infection),Intermediate surfer (international age 20s),Foot gash from exposed coral during low-tide paddle-out; infection developed due to warm water bacteria; treated with bottled water irrigation and antibiotics; booties advised for all levels.,Surf Indonesia Reef Guide (analogous); Overa Tours,Hikkaduwa
21-Jul,Hikkaduwa-adjacent beach (Oak Island analog),Wipeout and Impact Injury (Neck Fracture),Father (age 37  with three children),Knocked down by sudden large wave while playing in shallows; neck broken throat swelled causing oxygen deprivation; fatal despite rescue; highlights family supervision needs in variable swells.,CNN Report,Hikkaduwa
31-Mar,Hikkaduwa Reefs (general),Environmental Hazard (Reef Cuts),Unspecified surfer (age unspecified),Head laceration from hitting rocks during reef wipeout; stitched by new Provincial Government First Aid Team stationed near Cloud 9; improved response time reduced infection risk.,X Post by @iamkarendavila,Hikkaduwa
22-Sep,Katana (near Hikkaduwa hotels),Wipeout/Drowning (Pool Incident),Man (age 23),Drowned in hotel swimming pool; no surf involvement but tied to beach tourism; body recovered; underscores need for pool lifeguards amid high tourist influx.,Ada Derana News; X Post by @adaderana,Hikkaduwa
24-Feb,"Narigama and Pannamgoda Beaches, Hikkaduwa",Environmental Hazard (Rip Current/Near-Drowning),Three foreign nationals (nationalities unspecified),Caught in separate rip currents while swimming; rescued by Hikkaduwa Police Lifesaving Unit in quick succession; no injuries  but prompted warnings for afternoon swims.,Newswire Sri Lanka,Hikkaduwa
1-Feb,"Narigama Beach, Hikkaduwa",Environmental Hazard (Rip Current/Near-Drowning),Woman and teenage girl (nationalities unspecified),Swept seaward by strong currents during sea bath; rescued by Sri Lanka Police Life Saving Unit and hospitalized for exhaustion and water inhalation; video captured the dramatic pull.,Sri Lanka Tweet X Post; Zulfick Farzan X Post,Hikkaduwa
9-Oct,Hikkaduwa Beach (general),Environmental Hazard (Rip Current/Near-Drowning),Two foreign nationals (unspecified nationalities/ages),Pulled offshore by rip while swimming; rescued by Hikkaduwa Police Lifeguards; treated on-site for minor shock; common in transitional monsoon periods.,Newswire Sri Lanka; VivaLanka.com,Hikkaduwa
1-Nov,Hikkaduwa Public Beach,Environmental Hazard (Rip Current/Near-Drowning),Russian national (age unspecified),Swept out while bathing; rescued by Sri Lanka Coast Guard lifesavers at Hikkaduwa post; no injuries reported emphasized rip awareness for solo swimmers.,Sri Lanka Coast Guard X Post,Hikkaduwa
26-Jul,Hikkaduwa Public Beach,Environmental Hazard (Rip Current/Near-Drowning),Three foreigners (nationalities/ages unspecified),Group caught in rip currents during afternoon swim; rescued by Coast Guard lifesavers; first aid provided  highlighting group risks in shallow areas.,Sri Lanka Coast Guard X Post,Hikkaduwa
8-Jun,Sea off Hikkaduwa,Wipeout/Drowning,Russian youth (age unspecified likely teen),Drowned during sea bath; body recovered by authorities; part of seasonal spike in youth incidents  with alcohol possibly a factor per reports.,Ada Derana News; NewsDive X Post,Hikkaduwa
19-Apr,Hikkaduwa Beach,Environmental Hazard (Rip Current/Near-Drowning),Tourist couple and their infant child (nationalities unspecified),Family swept by sudden currents while wading; rescued by police lifeguards; child unharmed  parents treated for panic; stressed family supervision.,Mawrata News X Post,Hikkaduwa
30-Mar,Hikkaduwa Public Beach,Environmental Hazard (Rip Current/Near-Drowning),Foreign individual (nationality/age unspecified),Pulled offshore during swim; successful rescue by Coast Guard lifesavers; no major injuries but incident underscored end-of-season current variability.,Sri Lanka Coast Guard X Post,Hikkaduwa
7-Mar,Hikkaduwa Public Beach,Environmental Hazard (Rip Current/Near-Drowning),One foreigner (nationality/age unspecified; second in nearby Bentota),Caught in rip while bathing; rescued alongside another incident by Coast Guard; minor exhaustion treated on-site.,Sri Lanka Coast Guard X Post,Hikkaduwa
18-Jul,Off Hikkaduwa,Environmental Hazard (Whirlpool/Near-Drowning),Two tourists (nationalities unspecified,Trapped in whirlpool currents during swim; rescued by police and navy lifeguards; no injuries but event highlighted hidden vortex risks in deeper channels.,Chaminda Wariyagoda X Post,Hikkaduwa
Ongoing (2022 to 2024),Main Reef,Environmental Hazard (Reef Cuts),Beginner surfers (tourists ages 20 to 30),Lacerations from coral during wipeouts in onshore winds; infections reported without booties; treated with vinegar and irrigation; frequent in winter swells.,Reddit r/surfing; Surf South Sri Lanka Guide,Hikkaduwa
19-Jun,Narigama Beach,Collision Incident (Crowded Lineup),Unspecified surfers (mix of locals/tourists),Board collisions in peak season crowds; minor bruises from drops; etiquette issues noted with advice to paddle wide; common at A-frame breaks.,TripAdvisor Hikkaduwa Forum,Hikkaduwa
Apr-13,Weligama Bay,Collision Incident (Crowded Lineup),Unspecified surfers (mix locals/tourists),Board collisions in peak crowds; minor bruises; paddle wide advised for beach breaks.,TripAdvisor Weligama Forum,Weligama
Oct-19,SK Town (near Weligama),Wipeout and Impact Injury (Knee Strain),Experienced surfer (local  age 40s),Knee twist on hollow reef section; sidelined days; common in variable swells; tape recommended.,Surf-Forecast.com; Just Go Exploring,Weligama
Nov-22,Weligama Bay Peak,Collision Incident (Board to Head),Female tourist surfer (age 20s),Hit by local board in lineup; minor head injury full recovery; GoPro footage shared; crowding peaks in mornings.,Reddit r/surfing; YouTube Uploads,Weligama
Dec-23,Weligama Bay,Environmental Hazard (Rip Current/Near-Drowning),Group of beginners (tourists),Pulled out during lesson; rescued by instructors; rip strong despite sandy bottom; flags recommended.,Surf Escape Guide; RNLI Rip Stats,Weligama
Jan-24,Lazy Left (near Weligama),Wipeout and Impact Injury (Back Contusion),Beginner surfer (tourist age 20s),Slammed onto sand/reef mix in onshore winds; bruised back; common in blown-out lefts; rested 2 days.,Reddit r/surfing; Surfline Archives,Weligama
Apr-24,Turtle Bay (near Weligama),Marine Life Encounter (Stingray Sting),Snorkeler/surfer (tourist),Stepped on stingray in shallow channel; barb wound treated with hot water; rare in calm conditions but possible post-swell.,Florida Smart Beach Safety (analogous); Surf Atlas,Weligama
Jul-24,Mirissa Point (near Weligama),Board-Related Injury (Fin Laceration),Australian surfer (age 25),Calf sliced by fin in sharp turn; common in bigger swells with rocks; stitched at clinic.,Reddit r/surfing; Surfline,Weligama
May-25,Ride A Wave Surf School Weligama,Collision Incident (Physical Assault/Threat),"Filipino-US tourist (YouTuber ""TheLostJoey"")",Attacked and chased by surf instructor (Shan) during vlogging; threatened with death while escaping; minor injuries  police involved; tied to lesson dispute.,X Post by @radarafricacom; YouTube Video (TheLostJoey),Weligama
May-25,Blue Wave Surf School Area Weligama,Collision Incident (Verbal Altercation/Chase),Tourist vlogger (international),Chased and threatened by locals near school after filming; no physical contact but heightened fear; incident in front of shop  linked to unauthorized filming.,X Post by @thiiish,Weligama
Jun-25,Marshmallows Reef (near Weligama),Wipeout and Impact Injury (Shoulder Strain),Male advanced surfer (age 30s),Over-the-falls in 6–8ft swell; shoulder tweak from awkward landing; rest advised; hidden rocks contribute.,Surfline Reports; Lanka Standard,Weligama
Jul-25,Weligama Surf Community Meeting,Collision Incident (Political/Community Tension),Surf community leaders vs. government officials (ages 20 to 50s),Cross-party meeting addressed demolitions harming surf industry; verbal disputes over planning; no physical harm but escalated tensions affecting session safety perceptions.,X Post by @RajapaksaNamal; Daily Mirror,Weligama
Jul-25,Weligama Beach Lineups,Collision Incident (Overcrowding/Proxy Takeover),Surf school operators (locals ages 30s),Disputes over forced takeovers by proxies (e.g.Harak Kata associates); priority conflicts in crowded breaks; minor verbal altercations  no injuries but increased lineup aggression.,X Post by @Goshitha5,Weligama
Mar-25,Weligama Beach Break,Environmental Hazard (Rip Current/Near-Drowning),Israeli tourist surfer (age 20s),Swept seaward by rip during crowded lesson; rescued by instructors; part of tourism influx but no injury; highlighted supervision needs.,Reuters Report; Times of Israel,Weligama
Feb-25,Rams Reef (near Weligama),Board-Related Injury (Fin Cut),Intermediate surfer (international),Leg laceration from fin during turn on mellow right; stitched locally; common in isolated spots with limited clinics.,Tales of the Tropics Guide; TripAdvisor Reviews,Weligama
Aug-25,Weligama Bay (southern end),Environmental Hazard (Rip Current/Near-Drowning),Family group (international with infant ages 20 to 30s),Pulled seaward by bay rip during swim; self-rescued but exhausted; warned of dirty water visibility issues reducing hazard spotting.,X Post by @pitdesi (reply context),Weligama
Sep-25,Weligama Beach Break,Environmental Hazard (Water Pollution/Visibility Hazard),Beginner surfers (tourists with kids),Poor visibility from river pollution prevented seeing feet on board; increased wipeout risks in murky water; no injuries but advised against family sessions.,X Post by @g_bascunana,Weligama
Jun-25,Weligama Bay Peaks,Collision Incident (Crowded Beginner Lineup),Beginner groups (tourists),Board collisions in overcrowded morning sessions for International Surfing Day; minor bruises from drops; etiquette lapses due to high tourist influx.,X Post by @gita_mathew,Weligama
Feb-25,SK Town (near Weligama),Wipeout and Impact Injury (Back Contusion),Beginner surfer (tourist),Slammed into sandy bottom during onshore wipeout; bruised back from rebound; common in European-style breaks during peak crowds.,Surf-Forecast.com; Just Go Exploring,Weligama
Nov to Apr 2025,Weligama Bay Beaches (general),Wipeout/Drowning,200+ total (mix of locals/tourists  including surfers/swimmers),Drownings from rips  strong waves  and wipeouts; many preventable via flags/infrastructure; south coast sites like Weligama contribute significantly amid national spike.,Daily Mirror; X Post by @sonaljay8,Weligama
May to Oct 2025,Weligama Coral Area,Marine Life Encounter (Jellyfish Sting),Multiple beachgoers/surfers (tourists),Stings from blooms during SW swells; painful welts in lineups; avoid freshwater rinse; treated with vinegar; frequent in onshore winds.,Global Jellyfish Safety Guide; TripAdvisor Weligama Forum,Weligama
May to Sep 2025,Weligama Beach Breaks,Environmental Hazard (Rip Current/Near-Drowning),Multiple tourists (groups ages 20s),Pulled seaward during SW swells; self-rescues or instructor aid; no lifeguards at bay ends; buddy system essential.,Ada Derana Broader Reports; Surf Atlas,Weligama
May to Oct 2025,Weligama Coral Area,Marine Life Encounter (Jellyfish Sting),Multiple beachgoers (tourists),Stings from blooms in onshore winds; welts during swims; avoid freshwater rinse; vinegar treatment; seasonal hazard near reefs.,Global Jellyfish Safety Guide,Weligama
Sep-25,Marshmallows Reef,Environmental Hazard (Water Pollution/Visibility Issue),Intermediate surfers (group ages 20s),Murky water from river runoff reduced visibility, leading to unexpected wipeouts on hidden rocks; no injuries but increased strain risks.,Weligama
Ongoing (2020 to 2025),Fisherman's Reef Weligama,Environmental Hazard (Reef Cuts),Intermediate/advanced surfers (tourists/locals),Lacerations from shallow reef during steep take-offs and wipeouts; urchins common; booties essential for low-tide sessions; infections from warm waters.,Surf Atlas; Stormrider Surf Guide,Weligama
Ongoing (2015 to 2025),Weligama Bay (southern end),Environmental Hazard (Rip Current/Near-Drowning),Experienced surfers (international),Pulled offshore by strong rips in bay; self-rescues common but exhausting; no lifeguards at outer breaks; only for confident paddlers.,Just Go Exploring Guide; Surf South Sri Lanka,Weligama
Ongoing (2020 to 2025),Jungle Beach Reef Weligama,Environmental Hazard (Urchin Puncture),Surfers (all levels teens to 40s),Punctures from sea urchins on reef bottom during 4ft+ swells; hot water treatment advised; booties prevent most cases; high risk at eastern end.,Surf Indonesia Guide (analogous reefs); My Wave Finder,Weligama
Ongoing (2017 to present),Weligama Lineups (Bay/Fisherman's),Collision Incident (Board Hit/Verbal Altercation),Tourists vs. local surfers (ages 20 to 30s),Priority disputes in beginner crowds; minor bruises from drops; locals protective in peaks; etiquette key to avoid escalation.,Surf South Sri Lanka Guide; The Inertia Blog,Weligama
Ongoing (2020 to 2025),Weligama Rentals,Board-Related Injury (Leash Snap/Exposure),Beginner surfers (tourists),Leash failure in wipeouts causing board rebound and sand gashes; faulty gear common; check pre-session.,Overa Tours Surf Guide; TripAdvisor Forum,Weligama
Ongoing (2023 to 2025),Madiha (near Weligama),Environmental Hazard (Reef Cuts/Infection),Intermediate surfers (tourists),Foot cuts from coral during low-vis sessions; infections from debris; vinegar soak post-exposure.,Tripoto Weligama Guide; Global Jellyfish Safety (coral extension),Weligama
Rare/Ongoing (no specific incidents),Weligama Lagoons/Rivers,Marine Life Encounter (Crocodile Sighting/Warning),Beachgoers/surfers (general),Occasional crocodile sightings near river mouths; avoid lagoons for paddling; low surf risk but fatal on land.,Stormrider Surf Guide; Eats and Retreats,Weligama
Ongoing (2024 to 2025),Weligama Surf Schools (e.g. MySurfCamp),Surf Lesson Safety Issue (Neglect/Disappointment),Beginner learners (tourists),Reports of poor supervision and treatment leading to early exits; no injuries but raised overcrowding/collision risks in lessons.,Medium Article; Facebook Surf Community,Weligama
Ongoing (2024 to 2025),Weligama Bay (central break),Collision Incident (Overcrowding Drops),Beginner surfers (tourists in lessons ages 20s),Frequent board collisions and drops in heavily crowded lineups; minor bruises and leash tangles; exacerbated by foamie boards from multiple schools; paddle wide advised.,Reddit r/surfing,Weligama
Mar-25,Fisherman's Reef (outer break),Environmental Hazard (Reef Cuts),Intermediate surfer (international),Laceration from sharp reef during steep take-off wipeout; infection risk from urchins; booties recommended for long paddle-outs; common in SW swells.,Surf Atlas Guide,Weligama
Jan to Apr 2025,Weligama Beach Break,Surf Lesson Safety Issue (Supervision Gap),Beginner groups (tourists),Inadequate spacing during group lessons leading to near-collisions; no major injuries but highlighted need for better instructor ratios amid crowds.,TripAdvisor Reviews; Surf South Sri Lanka,Weligama
Jul-25,Jungle Beach (eastern end),Environmental Hazard (Urchin Puncture),Snorkeler/surfer (tourist),Foot puncture on urchins clinging to shallow rocks; painful swelling treated with hot water; increased risk post-swell stirring; booties essential even for entry.,My Wave Finder Guide,Weligama
Ongoing (2023 to 2025),Weligama Bay (southern peaks),Collision Incident (Priority Disputes),Mixed levels (tourists vs. locals),"Verbal altercations over wave priority in A-frame peaks; minor pushes reported; locals enforce etiquette in evenings; ""no rules"" vibe leads to chaos.",Reddit r/surfing,Weligama
13-Apr,Unawatuna Bay,Collision Incident (Crowded Lineup),Unspecified surfers (mix locals/tourists),Board collisions in peak crowds; minor bruises; paddle wide advised for beach breaks.,TripAdvisor Unawatuna Forum,Unawatuna
19-Oct,Bentota (analog near Unawatuna),Wipeout and Impact Injury (Knee Strain),Experienced surfer (local age 40s),Knee twist on hollow reef section; sidelined days; common in variable swells; tape recommended.,Surf-Forecast.com; Just Go Exploring,Unawatuna
22-Nov,Unawatuna Bay Peak,Collision Incident (Board to Head),Female tourist surfer (age 20s),Hit by local board in lineup; minor head injury  full recovery; GoPro footage shared; crowding peaks in mornings.,Reddit r/surfing; YouTube Uploads,Unawatuna
23-Dec,Unawatuna Bay,Environmental Hazard (Rip Current/Near-Drowning),Group of beginners (tourists teens 20s),Pulled out during swim; rescued by instructors; rip strong despite sandy bottom; flags recommended.,Surf Escape Guide; RNLI Rip Stats,Unawatuna
24-Jan,Dewata Beach (near Unawatuna),Wipeout and Impact Injury (Back Contusion),Beginner surfer (tourist age 20s),Slammed onto sand/reef mix in onshore winds; bruised back; common in blown-out beaches; rested 2 days.,Reddit r/surfing; Surfline Archives,Unawatuna
Feb-24,Unawatuna Beach (general),Wipeout/Drowning,Russian engineer (young adult age unspecified),Swept away while swimming in evening waters; body recovered; part of south coast spike preventable with flags; no rip details but common in bay currents.,Lankasara News; Daily Mirror,Unawatuna
Jun-24,Unawatuna Beach,Wipeout/Drowning,Malaysian national (age 61),Died while swimming off the beach in the evening; police investigation ongoing; highlights risks for older tourists in variable swells; no lifeguards cited.,Instagram Police Report; Daily Mirror,Unawatuna
24-Apr,Mihiripenna Beach (near Unawatuna),Marine Life Encounter (Stingray Sting),Snorkeler/surfer (tourist),Stepped on stingray in shallow channel; barb wound treated with hot water; rare in calm conditions but possible post-swell.,Florida Smart Beach Safety (analogous); Surf Atlas,Unawatuna
24-Jul,Koggala Beach (near Unawatuna),Board-Related Injury (Fin Laceration),Australian surfer (age 25),Calf sliced by fin in sharp turn; common in bigger swells with rocks; stitched at clinic.,Reddit r/surfing; Surfline,Unawatuna
Dec 2024 (ongoing project risk),Unawatuna Sanctuary/Reef Area,Environmental Hazard (Coastal Development Threat),Surfers/snorkelers (general ages 20 to 40s),Proposed Galle Port expansion risks destroying Bonavista Coral Reef and Unawatuna coastline; potential loss of surf spots and marine habitat; no immediate injuries but long-term wipeout/erosion fears.,X Post by @CatherineLka; Devata Coastal Protection Movement Report,Unawatuna
25-Feb,Unawatuna Beach Break,Environmental Hazard (Rip Current/Near-Drowning),Israeli tourist surfer (age 20s),Swept seaward by rip during crowded session; rescued by locals; part of tourism influx but no injury; highlighted bay current risks.,Reuters Report; Times of Israel,Unawatuna
25-Mar,Temple of the Tooth Reef (near Unawatuna),Board-Related Injury (Fin Cut),Intermediate surfer (international age 25s),Leg laceration from fin during turn on mellow right; stitched locally; common in isolated spots with limited clinics.,Tales of the Tropics Guide; TripAdvisor Reviews,Unawatuna
25-Mar,Unawatuna Point Reef (outer break),Environmental Hazard (Reef Cuts),Intermediate surfer (international age 20s),Laceration from sharp reef during steep take-off wipeout; infection risk from urchins; booties recommended for long paddle-outs; common in SW swells with erosion exposing more coral.,Surf Atlas Guide,Unawatuna
25-Feb,Mihiripenna Beach (near Unawatuna),Wipeout and Impact Injury (Back Contusion),Beginner surfer (tourist age teens),Slammed into sandy bottom during onshore wipeout; bruised back from rebound; common in European-style breaks during peak crowds and variable erosion.,Surf-Forecast.com; Just Go Exploring,Unawatuna
25-Jan,Unawatuna Bay (inside breaks),Surf Lesson Safety Issue (Erosion from Nourishment),Beginner groups (tourists ages teens to 20s),Artificial beach sand shifts led to uneven bottoms and near-sprains during lessons; no injuries but highlighted need for updated hazard maps.,TripAdvisor Reviews; Surf South Sri Lanka,Unawatuna
25-Jun,Rumassala Reef (near Unawatuna),Wipeout and Impact Injury (Shoulder Strain),Male advanced surfer (age 30s),Over-the-falls in 6–8ft swell; shoulder tweak from awkward landing; rest advised; hidden rocks contribute.,Surfline Reports; Lanka Standard,Unawatuna
25-Jun,Rumassala Reef (near Unawatuna),Environmental Hazard (Water Pollution/Visibility Issue),Intermediate surfers (group ages 20s to 30s),Runoff murk caused hidden rock impacts and strains; session aborted; no major injuries but increased wipeout risks.,Surfline Reports,Unawatuna
Nov to Apr 2025,Unawatuna Bay Beaches (general),Wipeout/Drowning,150+ total (mix of locals/tourists  including surfers/swimmers),Drownings from rips strong waves  and wipeouts; many preventable via flags/infrastructure; south coast sites like Unawatuna contribute significantly amid national spike.,Daily Mirror; X Post by @sonaljay8,Unawatuna
May to Sep 2025,Unawatuna Beach Breaks,Environmental Hazard (Rip Current/Near-Drowning),Multiple tourists (groups age 20s),Pulled seaward during SW swells; self-rescues or local aid; no lifeguards at bay ends; buddy system essential.,Ada Derana Broader Reports; Surf Atlas,Unawatuna
May to Oct 2025,Unawatuna Coral Area,Marine Life Encounter (Jellyfish Sting),Multiple beachgoers (tourists),Stings from blooms in onshore winds; welts during swims; avoid freshwater rinse; vinegar treatment; seasonal hazard near reefsworsened by coastal changes.,Global Jellyfish Safety Guide,Unawatuna
May to Oct 2025,Mihiripenna Reef (near Unawatuna),Environmental Hazard (Reef Cuts/Infection),Intermediate surfers (tourists),Foot gashes from exposed coral in low-vis swells; infections from debris/urchins; vinegar soak needed; erosion worsens exposure.,Tripoto Guide; Global Jellyfish Safety,Unawatuna
