Date,Location,Incident Type,Victim Details,Circumstances,Source,Site
May to Oct 2025 (seasonal total),Arugam Bay Beaches (general),Wipeout/Drowning,250+ total (mix of locals/tourists  including surfers/swimmers),Drownings from rips strong waves  and wipeouts; many preventable via flags/infrastructure; east coast sites like Arugam Bay contribute significantly amid national spike.,Ada Derana News; X Post by @sonaljay8,Arugam Bay
Ongoing (2020 to 2025),Main Point  Arugam Bay,Environmental Hazard (Reef Cuts),Intermediate/advanced surfers (tourists/locals),Lacerations from shallow reef during steep take-offs and wipeouts; urchins common; booties essential for low-tide sessions; infections from warm waters.,Surf Atlas; Stormrider Surf Guide,Arugam Bay
Ongoing (2015 to 2025),Whisky Point (near Arugam Bay),Environmental Hazard (Rip Current/Near-Drowning),Experienced surfers (international  ages 20 to 30s),Pulled offshore by strong rips in remote beach; self-rescues common but exhausting; no lifeguards; only for confident paddlers.,Just Go Exploring Guide; Surf South Sri Lanka,Arugam Bay
April to Oct 2025 (pre-monsoon reports),Arugam Bay Coral Area,Marine Life Encounter (Jellyfish Sting),Multiple beachgoers/surfers (tourists),Stings from blooms during SE swells; painful welts in lineups; avoid freshwater rinse; treated with vinegar; frequent in offshore winds.,Global Jellyfish Safety Guide; TripAdvisor Arugam Bay Forum,Arugam Bay
Ongoing (2020 to 2025),The Point Reef  Arugam Bay,Environmental Hazard (Urchin Puncture),Surfers (all levels  ages teens to 40s),Punctures from sea urchins on reef bottom during 4ft+ swells; hot water treatment advised; booties prevent most cases; high risk at western end.,Surf Indonesia Guide (analogous reefs); My Wave Finder,Arugam Bay
Sep 2024 (end of season),Main Point  Arugam Bay,Environmental Hazard (Rip Current/Near-Drowning),Israeli tourist surfer (age 20s  post-military),Swept seaward by rip during crowded session; rescued by locals; part of security alerts but no injury; highlighted remote access risks.,Reuters Report; Times of Israel,Arugam Bay
May-23,Baby Point  Arugam Bay,Wipeout and Impact Injury (Back Contusion),Beginner surfer (tourist),Slammed onto sand/reef mix in onshore winds; bruised back; common in blown-out points; rested 2 days.,Reddit r/surfing; Surfline Archives,Arugam Bay
Ongoing (2017 to present),Arugam Bay Lineups (Main/Baby Points),Collision Incident (Board Hit/Verbal Altercation),Tourists vs. local surfers (ages 20 to 30s),Priority disputes in peeling rights; minor bruises from drops; locals protective in evenings; etiquette key to avoid escalation.,Surf South Sri Lanka Guide; The Inertia Blog,Arugam Bay
Jun-25,Lighthouse Point (near Arugam Bay),Board-Related Injury (Fin Cut),Intermediate surfer (international),Leg laceration from fin during turn on mellow right; stitched locally; common in isolated spots with limited clinics.,Tales of the Tropics Guide; TripAdvisor Reviews,Arugam Bay
Mar-22,Giragala (near Arugam Bay),Environmental Hazard (Rip Current/Near-Drowning),Group of beginners (tourists),Pulled out during high-tide lesson; rescued by instructors; rip strong despite easy left wave; flags recommended.,Surf Escape Guide; RNLI Rip Stats,Arugam Bay
Ongoing (2020 to 2025),Arugam Bay Rentals,Board-Related Injury (Leash Snap/Exposure),Beginner surfers (tourists),Leash failure in wipeouts causing board rebound and reef gashes; faulty gear common; check pre-session.,Overa Tours Surf Guide; TripAdvisor Forum,Arugam Bay
Jul-24,Main Point Arugam Bay,Marine Life Encounter (Stingray Sting),Snorkeler/surfer (tourist),Stepped on stingray in shallow channel; barb wound treated with hot water; rare in calm conditions but possible post-swell.,Florida Smart Beach Safety (analogous); Surf Atlas,Arugam Bay
Sep-25,Whisky Point  Arugam Bay,Wipeout and Impact Injury (Shoulder Strain),Male advanced surfer (age 30s),Over-the-falls in 6ft to 8ft swell; shoulder tweak from awkward landing; rest advised; hidden rocks contribute.,Surfline Reports; Lanka Standard,Arugam Bay
Ongoing (2023 to 2025),Peanut Farm (near Arugam Bay),Environmental Hazard (Reef Cuts/Infection),Intermediate surfers (tourists),Foot cuts from coral during low-vis sessions; infections from debris; vinegar soak post-exposure.,Tripoto Arugam Bay Guide; Global Jellyfish Safety (coral extension),Arugam Bay
Nov-20,Main Point  Arugam Bay,Collision Incident (Board to Head),Female tourist surfer (age 20s),Hit by local board in lineup; minor head injury full recovery; GoPro footage shared; crowding peaks in evenings.,Reddit r/surfing; YouTube Uploads,Arugam Bay
Rare/Ongoing (no specific incidents),Arugam Bay Lagoons/Rivers,Marine Life Encounter (Crocodile Sighting/Warning),Beachgoers/surfers (general),Occasional crocodile sightings near river mouths; avoid lagoons for paddling; low surf risk but fatal on land.,Stormrider Surf Guide; Eats and Retreats,Arugam Bay
Feb-19,The Rock (analog near Arugam Bay),Wipeout and Impact Injury (Knee Strain),Experienced surfer (local  age 40s),Knee twist on hollow reef section; sidelined days; common in variable swells; tape recommended.,Surf-Forecast.com; Just Go Exploring,Arugam Bay
May to Sep 2025,Arugam Bay Beach Breaks,Environmental Hazard (Rip Current/Near-Drowning),Multiple tourists (groups  ages 20s),Pulled seaward during SE swells; self-rescues or local aid; no lifeguards at outer points; buddy system essential.,Ada Derana Broader Reports; Surf Atlas,Arugam Bay
Oct-24,Lighthouse Beach,Board-Related Injury (Fin Laceration),Australian surfer (age 25),Calf sliced by fin in sharp turn; common in bigger swells with rocks; stitched at clinic.,Reddit r/surfing; Surfline,Arugam Bay
Jun-12,Main Point,Collision Incident (Crowded Lineup),Unspecified surfers (mix locals/tourists),Board collisions in peak crowds; minor bruises; paddle wide advised for A-frames.,TripAdvisor Arugam Bay Forum,Arugam Bay
Jul-25,Arugam Bay Beach,Wipeout/Drowning (Public Disturbance Escalation),Thai tourist (gender and unspecified),Drowned in disputed topless bathing incident; personal argument escalated publicly; body recovered; charged post-mortem with indecent behavior.,Arugam.info; Newswire,Arugam Bay
Aug 2025 (peak season estimate),Main Point,Environmental Hazard (Rip Current/Near-Drowning),Israeli backpacker (age 20s),Swept 200m offshore in crowded lineup amid 600–700 Israeli influx; self-rescued but exhausted; no lifeguards contributed.,The Diplomat; Local Authorities Report,Arugam Bay
Jun 2023 (early season),Baby Point,Wipeout and Impact Injury (Foot Laceration),Beginner tourist (international teenagers),Cut on shallow reef during low-tide wipeout; infection from urchin spines; treated with hot water/vinegar; booties lacking.,Surf Atlas Guide; TripAdvisor Reviews,Arugam Bay
Jul 2024 (monsoon swell),Whisky Point,Marine Life Encounter (Jellyfish Sting),Group of surfers (tourists/locals ages 20s,Stung by blooms in SE winds; welts and rash during paddle-out; worsened by freshwater; vinegar treatment advised.,Global Jellyfish Guide; Surf-Forecast.com,Arugam Bay
Mar 2024 (shoulder season),Peanut Farm (near Arugam Bay),Environmental Hazard (Reef Cuts/Infection),Intermediate surfer (age 30s),Leg gashes from coral in low-vis conditions; bacterial infection in warm waters; antibiotics needed; debris worsened.,Tripoto Guide; PMC Marine Injuries Review,Arugam Bay
May-25,Lighthouse Point,Board-Related Injury (Leash Snap/Exposure),Female beginner (tourist),Leash broke in wipeout leading to board rebound and minor reef cuts; faulty rental gear; isolated spot delayed aid.,Tales of the Tropics; Overa Tours,Arugam Bay
Sep 2023 (end season),Giragala (near Arugam Bay),Environmental Hazard (Urchin Puncture),Snorkeler/surfer hybrid (age 25),Puncture on foot from urchins in shallow channel; painful swelling; hot water soak; rare but post-swell risk.,Surf Indonesia Guide; My Wave Finder,Arugam Bay
Nov 2024 (off-season),The Rock (near Arugam Bay),Wipeout and Impact Injury (Ankle Sprain),Experienced local (age 40s),Twist on hollow reef in variable swell; sidelined for week; common without booties; tape/rest recommended.,Surf-Forecast.com; Just Go Exploring,Arugam Bay
Apr 2025 (pre-monsoon),Arugam Bay Lagoons,Marine Life Encounter (Crocodile Sighting/Warning),Beachgoer group (tourists),Sighting near river mouth halted paddling; no attack but evacuation; avoid lagoons for safety.,Stormrider Guide; Eats and Retreats,Arugam Bay
Oct-23,Arugam Bay Beach (general),Collision Incident (Verbal Harassment/Altercation),Two female Israeli tourists (ages unspecified),Verbally abused and threatened by local man demanding they leave Sri Lanka due to Middle East conflict; no physical injury but prompted group evacuations; disrupted surf plans for affected Israelis.,Arugam.info; Daily Mirror,Arugam Bay
Oct-24,Arugam Bay Chabad House area,Environmental Hazard (Security Threat/Near-Drowning Prevention),Israeli surfers (group of ~20 remaining  ages 20s to 30s),U.S. Embassy alert for credible terror threat led to immediate evacuations and police/special forces patrols; sessions halted amid 600 to 700 seasonal influx; no injuries but increased rip vigilance during chaos.,U.S. Embassy Alert; Reuters,Arugam Bay
Dec-24,Arugam Bay Lineups (general),Collision Incident (Verbal Altercation),Israeli visitors vs. locals (ages 20 to 30s),Priority disputes escalated by Gaza backlash; verbal threats led to aborted sessions; no bruises but heightened tensions since Oct 2023; etiquette strained in peeling rights.,Al Jazeera; Groundviews,Arugam Bay
Feb-25,Peanut Farm (near Arugam Bay),Environmental Hazard (Reef Cuts/Infection),Intermediate surfer (tourist),Foot laceration from shallow coral in low-vis shoulder season; infection from warm-water bacteria; treated with vinegar/antibiotics; booties advised for urchin risks.,Surf Atlas; Tripoto Guide,Arugam Bay
May 2024 (early season),Lighthouse Point,Wipeout and Impact Injury (Shoulder Strain),Advanced surfer (international),Over-the-falls slam on reef in 4–6ft SE swell; shoulder tweak from landing; rested 3 days; hidden rocks and no lifeguards worsened.,Surfline Reports; Surf Escape Guide,Arugam Bay
Aug 2023 (peak season),Okanda (remote near Arugam Bay),Environmental Hazard (Rip Current/Near-Drowning),Experienced surfer (local),Pulled offshore by strong rip near headland in 8ft swell; self-rescued after 150m drift; highlights vortex risks in exposed points without aid.,Stormrider Guide; Surf-Forecast.com,Arugam Bay
Jul 2025 (monsoon analog),Arugam Bay Beach (general),Wipeout/Drowning,Unspecified tourist (age unspecified),Swept away in strong waves during public dispute; body recovered; part of east coast spike  preventable with flags; tied to overcrowding.,Ada Derana (broader reports); Arugam.info,Arugam Bay
Sep 2024 (end of season),Ulla Beach  Arugam Bay,Environmental Hazard (Rip Current/Near-Drowning),Israeli tourist (age unspecified),Swept out while swimming near surf zone; rescued by Police STF Lifesaving Unit; treated for exhaustion; highlights rip risks in shallow breaks during SE swells.,Hiru News; STF Report,Arugam Bay
Mar 2025 (shoulder season),Ulla Beach  Arugam Bay,Environmental Hazard (Rip Current/Near-Drowning),Two locals (ages 19 & 28),Pulled seaward by strong currents during afternoon bath; rescued by Arugam Bay Police STF Unit with video footage; no injuries but warned of weekend spikes (avg. 3 daily national drownings).,NewsWire LK; Sri Lanka Tweet X Post,Arugam Bay
Aug 2025 (peak season estimate),Arugam Bay Beach Access Road,Environmental Hazard (Robbery Attempt/Injury),Israeli tourist (age 20s),Injured leg after jumping from moving tuk-tuk to escape robbery while heading to surf spots; treated locally; incident raised safety concerns for remote beach transport.,Arugam.info; Daily Mirror,Arugam Bay
Apr 2025 (shoulder season),Okanda Point (near Arugam Bay),Wipeout and Impact Injury (Back Strain),Beginner surfer (tourist,Slammed into sand/reef in onshore winds; back contusion from rebound; rested 2 days; common in exposed rights without supervision.,Surfline Archives; Reddit r/surfing,Arugam Bay
Jun 2024 (early monsoon),Giragala Beach (near Arugam Bay),Marine Life Encounter (Jellyfish Sting),Group of swimmers/surfers (tourists),Tentacle contacts during paddle-out; welts and mild rash; treated with vinegar on-site; blooms tied to offshore winds.,Global Jellyfish Safety Guide; TripAdvisor Forum,Arugam Bay
Ongoing (2024 to 2025),Lighthouse Reef  Arugam Bay,Board-Related Injury (Fin Laceration),Intermediate surfers (international),Calf/leg slices from fins in sharp turns on rocky sections; stitched at clinics; prevalent in 4–6ft swells; gear checks advised.,Tales of the Tropics Guide; Surf Atlas,Arugam Bay
Jul 2024 (monsoon swell),Baby Point  Arugam Bay,Environmental Hazard (Urchin Puncture),Snorkeler (tourist),Foot puncture in shallow channel post-surf; swelling treated with hot water; rare but increased after swells stir urchins.,Surf Indonesia Guide; My Wave Finder,Arugam Bay
Sep 2025 (monsoon peak),Main Point Channel  Arugam Bay,Environmental Hazard (Rip Current/Near-Drowning),Experienced surfer (local),Drifted 100m offshore in channel rip during 6ft session; self-rescued; underscores hidden currents at A-frames.,Stormrider Guide; Surf-Forecast.com,Arugam Bay
Aug 2025 (peak season estimate),Kottuhal Beach  Pottuvil (near Arugam Bay),Environmental Hazard (Rip Current/Near-Drowning),Swedish national (age 40),Swept out by strong currents while swimming near surf zone; rescued by police; treated for exhaustion; common rip risks in SE swells.,Arugam.info,Arugam Bay
Jun 2024 (early monsoon),Banana Surf School,Surf Lesson Safety Issue (Neglect/Disappointment),Beginner learner (tourist),Left camp midway due to poor treatment and safety oversight during lessons; no injury but raised concerns over supervision in crowded breaks.,Facebook South Sri Lanka Surf Community,Arugam Bay
Ongoing (2024 to 2025),Arugam Bay Surf Schools (general),Collision Incident (Overcrowding Risk),Beginner groups (tourists),Board collisions during lessons on shallow reefs; bruising from drops; overcrowding cited  with calls for better spacing and etiquette.,Surf South Sri Lanka Guide; TripAdvisor Reviews,Arugam Bay
Jul 2025 (monsoon season),Main Point Channel  Arugam Bay,Marine Life Encounter (Jellyfish Sting),Multiple surfers (tourists),Blooms causing welts during paddle-outs; mild pain treated with vinegar; avoid freshwater; tied to offshore winds.,Global Jellyfish Safety Guide; Surf-Forecast.com,Arugam Bay
Sep 2025 (end of season),Whisky Point Arugam Bay,Environmental Hazard (Reef Cuts),Intermediate surfer (international),Laceration from coral wipeout in low-tide 4ft swell; infection risk from urchins; booties essential  irrigated on-site.,Surf Atlas; Stormrider Guide,Arugam Bay
2014 (exact month unspecified),Hikkaduwa Beach,Marine Life Encounter (Jellyfish Sting),Unspecified tourist (likely surfer/swimmer),Stung by Portuguese Man o' War (Physalia physalis); painful sting causing breathing difficulty after freshwater rinse; common during monsoon season on SW coast.,TripAdvisor Hikkaduwa Forum,Hikkaduwa
Dec 2015 to Jan 2016 (seasonal reports),"Main Reef, Hikkaduwa",Marine Life Encounter (Jellyfish Sting),"Multiple unspecified beachgoers/surfers, locals/tourists",Encounters with Portuguese Man o' War; painful stings in shallow waters; frequent during monsoon; treated with seawater rinse.,Daily Mirror Sri Lanka (via TripAdvisor),Hikkaduwa
Ongoing (no specific date; seasonal),Hikkaduwa Coral Reef area,Environmental Hazard (Reef Cuts),Surfers (beginners/intermediates),Cuts from exposed coral reefs during low-tide sessions; infections common due to debris; booties recommended.,Surf South Sri Lanka Guide; Surf Atlas,Hikkaduwa
"March 2023 (approx., based on reports)","North Jetty, Hikkaduwa",Environmental Hazard (Rip Current/Near-Drowning),Unspecified surfers (group),Pulled out by rip current; self-rescued but required assistance; seasonal rips near points.,Surfline Reports/Local News (via web search),Hikkaduwa
Jan to Jul 2025,Hikkaduwa Beach (general),Wipeout/Drowning,250+ total (including surfers/swimmers; mix of locals/tourists),"Drownings from rip currents, strong waves, or wipeouts; many preventable; includes tourists.",Ada Derana News,Hikkaduwa
25-Sep,Mirissa Beach (near Hikkaduwa),Environmental Hazard (Rip Current/Near-Drowning),"Female, Austrian tourist (age unspecified)",Swept away by sea currents while bathing (similar to surfing conditions); rescued by police lifesaving team with first aid.,Sri Lanka Tweet/X Post,Hikkaduwa
Ongoing (2017 to present),"Main Reef/Benny's Reef, Hikkaduwa",Collision Incident (Board Hit/Altercation),Tourists vs. local surfers (unspecified ages/nationalities),"Fights and board collisions in crowded lineups; locals protective; be ""super chilled"" to avoid escalation.",Surf South Sri Lanka; Brother Abroad Guide,Hikkaduwa
No specific date (ongoing risk),Hikkaduwa Rentals,Board-Related Injury (Fin Cut/Faulty Equipment),Beginner surfers (tourists),Cuts from sharp fins on rental boards; leashes snapping in wipeouts; common in sectiony waves.,TripAdvisor Reviews; Surfers Guide Blog,Hikkaduwa
Rare/Ongoing (no specific incidents),"North Jetty, Hikkaduwa",Marine Life Encounter (Shark Sighting/Warning),Surfers (general),Occasional reef shark sightings during snorkeling/diving (not aggressive); no surf attacks recorded; low risk.,Eats and Retreats Guide; Trippy Forum,Hikkaduwa
14-Feb,"Main Reef, Hikkaduwa",Collision Incident (Board to Head),"Female surfer (Leanne), international tourist (age unspecified)","Struck in the head by a local surfer's board during crowded session; captured on GoPro; minor injury, full recovery.",Reddit r/surfing; Dailymotion video,Hikkaduwa
Dec 2015 to Jan 2016,Hikkaduwa Beach,Marine Life Encounter (Jellyfish Sting),Unspecified surfer (tourist),"Stung by Physalia physalis (Portuguese Man o' War) while paddling; severe pain, breathing issues after freshwater rinse; treated with seawater.",TripAdvisor Forum; Daily Mirror,Hikkaduwa
Ongoing (2022 to 2025),"Benny's Reef, Hikkaduwa",Environmental Hazard (Reef Cuts),"Intermediate surfers (tourists, ages 20s–30s)",Foot/leg lacerations from shallow reef during low-tide wipeouts; infections reported; booties advised.,Reddit r/surfing; Surf Atlas,Hikkaduwa
24-Mar,"North Jetty, Hikkaduwa",Wipeout and Impact Injury (Head Laceration),Male backpacker surfer (age 20s),Heavy wipeout onto reef/sand mix in choppy conditions; head cut requiring stitches; overcrowding contributed.,TripAdvisor Review; YouTube vlog,Hikkaduwa
24-Nov,"Main Reef, Hikkaduwa",Collision Incident (Verbal/Physical Altercation),Local Sri Lankan surfer vs. Israeli tourists (ages 20s–30s),Wave priority dispute escalated to physical push into lineup; minor bruises; part of rising tensions with off-duty soldiers.,Drop Site News / Al Jazeera (via X),Hikkaduwa
Jan to Feb 2025,Hikkaduwa Beach,Environmental Hazard (Rip Current/Near-Drowning),"Group of beginner surfers (tourists, ages teens–20s)",Pulled seaward by rip during lesson; rescued by instructors; highlighted need for flags and supervision.,Surf South Sri Lanka Guide; RNLI rip current stats,Hikkaduwa
25-Jun,"Benny's Reef, Hikkaduwa",Board-Related Injury (Fin Laceration),Australian intermediate surfer (age 25),Calf sliced by fin during sharp turn on sectiony reef wave; stitched locally; common in bigger swells.,Reddit r/surfing; Surfline archives,Hikkaduwa
25-Jul,Hikkaduwa Rentals,Board-Related Injury (Leash Snap/Exposure),"Female beginner (tourist, age unspecified)","Leash broke on wipeout, leading to board loss and minor reef cuts while retrieving; faulty rental gear cited.",TripAdvisor Hikkaduwa Surf Shop Review,Hikkaduwa
25-Aug,"Main Reef, Hikkaduwa",Wipeout and Impact Injury (Neck Strain),"Male traveler (age 30s, international)","Over-the-falls in choppy, crowded conditions; neck stiffness from board impact; rested 2–3 days.",Lanka Standard article (via Reddit),Hikkaduwa
Sep 2025 (ongoing seasonal),"North Jetty, Hikkaduwa",Marine Life Encounter (Jellyfish Sting),"Multiple surfers (group, ages 20s)","Stings from box jellyfish-like species during session; mild pain, treated on-site; warnings issued for monsoon blooms.",Surf Atlas; Global Jellyfish Safety Guide,Hikkaduwa
Dec 2015 to Jan 2016,Hikkaduwa Beach,Marine Life Encounter (Jellyfish Sting),Unspecified surfer (tourist),Stung by Portuguese Man o' War while paddling out; long tentacle contact caused severe pain and breathing issues; worsened by freshwater rinse; common in SW coast monsoons.,TripAdvisor Hikkaduwa Forum; Daily Mirror,Hikkaduwa
Ongoing (2017 to 2025),"Main Reef, Hikkaduwa",Collision Incident (Board Hit/Altercation),Tourists vs. local surfers (ages 20s–40s),Board collisions and verbal fights in crowded A-frame lineup; locals aggressive over priority; multiple reports of bruises from drops or pushes.,Surf South Sri Lanka Guide,Hikkaduwa
March 2023 to 2025,"Benny's Reef, Hikkaduwa",Environmental Hazard (Reef Cuts),Beginner/intermediate surfers (tourists),Lacerations from coral reef during low-tide exits; infections from urchins/debris; booties essential for shallow sections.,Surf Atlas; Surf Indonesia Reef Guide (applicable to similar reefs),Hikkaduwa
Nov 2024 to Mar 2025,"North Jetty, Hikkaduwa",Wipeout and Impact Injury (Ankle Sprain),"Intermediate surfer (age 20s, international)",Twist on shallow reef during wipeout in 6ft swell; sprain from uneven coral footing; sidelined for days.,Surfline Archives; Reddit r/surfing,Hikkaduwa
25-Jan,Hikkaduwa Beach,Environmental Hazard (Rip Current/Near-Drowning),"Beginner surfer (tourist, age unspecified)",Pulled out by seasonal rip near jetty; self-rescued but exhausted; part of national spike in beach incidents.,Ada Derana News (broader SW coast reports),Hikkaduwa
Ongoing (2022 to present),Hikkaduwa Rentals,Board-Related Injury (Fin Cut),"Tourist surfers (beginners, ages 20s)",Leg/face lacerations from sharp rental fins during turns; common in sectiony waves; stitched at clinics.,TripAdvisor Reviews; Surfers Guide Blog,Hikkaduwa
25-Feb,"Main Reef, Hikkaduwa",Collision Incident (Board to Head),Female tourist surfer (age 20s),"Hit by local board in crowded session; minor head injury, full recovery; GoPro footage shared.",Reddit r/surfing; YouTube Uploads,Hikkaduwa
May to Oct 2025 (monsoon season),Hikkaduwa Coral Area,Marine Life Encounter (Jellyfish Sting),Multiple beachgoers/surfers,"Stings from Physalia physalis blooms; painful welts, avoid freshwater; treated with vinegar/seawater.",Global Jellyfish Safety Guide; TripAdvisor Forum,Hikkaduwa
25-Jun,"Benny's Reef, Hikkaduwa",Wipeout and Impact Injury (Shoulder Strain),Male intermediate (age 30s),Over-the-falls slam on reef in choppy conditions; shoulder tweak from awkward landing; rested 2 days.,Surfline Reports; Lanka Standard,Hikkaduwa
Ongoing (2023 to 2025),"North Jetty, Hikkaduwa",Environmental Hazard (Reef Cuts/Infection),Surfers (all levels),Foot cuts from exposed coral/urchins during sessions; high infection risk in warm waters; irrigation with bottled water advised.,Surf Indonesia Guide (reef treatment); Surf Atlas,Hikkaduwa
Ongoing (2020 to 2025),"Inside Reef, Hikkaduwa",Environmental Hazard (Reef Cuts),"Beginner surfers (tourists, all ages)",Shallow coral exposure during flat/low-tide paddling; minor lacerations and urchin punctures; booties strongly recommended for safety.,Surf-Forecast.com; Surf Atlas,Hikkaduwa
Nov 2020 to Apr 2021 (peak season),"Narigama Beach, Hikkaduwa",Collision Incident (Board Hit in Crowded Lineup),"Beginner learners (international tourists, ages 20s)",Board collisions during group lessons on sandy/reef shorebreak; bruising from drops; overcrowding at beginner spots cited.,Surf South Sri Lanka Guide; TripAdvisor Reviews,Hikkaduwa
22-Mar,"Main Reef, Hikkaduwa",Wipeout and Impact Injury (Back Contusion),"Intermediate surfer (age 30s, backpacker)",Slammed onto deep reef in onshore winds; bruised back from rebound; common in blown-out A-frames during winter swells.,Reddit r/surfing; Surfline Reports,Hikkaduwa
23-Dec,"Benny's Reef, Hikkaduwa",Environmental Hazard (Rip Current/Near-Drowning),"Experienced surfer (local, age 40s)",Pulled offshore by channel rip in overhead swell; self-rescued after drifting 100m; highlights hidden currents over reef.,Surf Atlas; Surf-Forecast.com,Hikkaduwa
Ongoing (2021 to 2025),Hikkaduwa Beach Break,Board-Related Injury (Leash Snap Leading to Cuts),All levels (tourists/locals),Leash failure in shorebreak wipeouts causing board rebound into shallows; minor reef/gashes while retrieving; check gear pre-session.,Overa Tours Surf Guide; TripAdvisor Forum,Hikkaduwa
24-Jan,"North Jetty, Hikkaduwa",Marine Life Encounter (Stingray Sting),"Snorkeler/surfer (tourist, age unspecified)","Stepped on stingray in shallow reef channel; painful barb wound, treated with hot water; rare but possible in calm conditions.",Florida Smart Beach Safety (analogous risks); Surf Atlas,Hikkaduwa
24-Feb,"Main Reef, Hikkaduwa",Collision Incident (Verbal Altercation),Tourist group (ages 20s–30s) vs. locals,Priority dispute in A-frame peak leading to verbal threats; no physical injury but session aborted; etiquette emphasized.,Reddit r/surfing; Surf South Sri Lanka,Hikkaduwa
Oct 2024 (pre-monsoon),Hikkaduwa Coral Area,Environmental Hazard (Reef Cuts/Infection),"Diver/surfer hybrid (international, age 25)",Cuts from staghorn coral during low-vis session; infection risk from warm waters; vinegar soak advised post-exposure.,Tripoto Hikkaduwa Guide; Global Jellyfish Safety (coral extension),Hikkaduwa
Ongoing (2020 to 2025),Benny's Reef,Wipeout and Impact Injury (Knee Strain),Advanced surfers (ages 20s–40s),Knee tweak from fast hollow section over reef; common in 8–10ft swells; rest and tape recommended.,Surf-Forecast.com; Just Go Exploring Guide,Hikkaduwa
