Date,Location,Incident Type,Victim Details,Circumstances,Source,Site
May to Oct 2025,Unawatuna Coral Area,Marine Life Encounter (Jellyfish Bloom Warning),Beachgoers/surfers (tourists),Blooms triggered by onshore winds and pollution; welts during swims; avoid freshwater; vinegar treatment; seasonal risk near reefs.,Global Jellyfish Safety Guide; Surf-Forecast.com,Unawatuna
25-Sep,Rumassala Reef,Environmental Hazard (Water Pollution/Visibility Issue),Intermediate surfers (group ages 20s to 30s),Murky water from river runoff reduced visibility  leading to unexpected wipeouts on hidden rocks; no injuries but increased strain risks amid erosion projects.,Surfline Reports,Unawatuna
25-Aug,Koggala Lagoon (near Unawatuna),Marine Life Encounter (Crocodile Sighting/Warning),Beachgoer group (tourists),Sighting near river mouth prompted evacuation; no attack but halted paddling; avoid lagoons especially at dusk.,Stormrider Guide; Eats and Retreats,Unawatuna
25-Aug,Dewata Beach (near Unawatuna),Environmental Hazard (Visibility from Runoff),Snorkeler/surfer (tourist),Murky water from river pollution hid rocks  causing minor strains; session aborted; avoid after rains.,Surfline Reports,Unawatuna
Ongoing (2020 to 2025),Unawatuna Point Reef,Environmental Hazard (Reef Cuts),Intermediate/advanced surfers (tourists/locals ages 20s to 40s),Lacerations from shallow reef during steep take-offs and wipeouts; urchins common; booties essential for low-tide sessions; infections from warm waters.,Surf Atlas; Stormrider Surf Guide,Unawatuna
Ongoing (2015 to 2025),Unawatuna Bay (western end),Environmental Hazard (Rip Current/Near-Drowning),Experienced surfers (international),Pulled offshore by strong rips in bay; self-rescues common but exhausting; no lifeguards at outer breaks; only for confident paddlers.,Just Go Exploring Guide; Surf South Sri Lanka,Unawatuna
May to Oct 2025,Unawatuna Coral Area,Marine Life Encounter (Jellyfish Sting),Multiple beachgoers/surfers (tourists),Stings from blooms during SW swells; painful welts in lineups; avoid freshwater rinse; treated with vinegar; frequent in onshore winds.,Global Jellyfish Safety Guide; TripAdvisor Unawatuna Forum,Unawatuna
Ongoing (2020 to 2025),Jungle Beach Reef Unawatuna,Environmental Hazard (Urchin Puncture),Surfers (all levels ages teens to 40s),Punctures from sea urchins on reef bottom during 4ft+ swells; hot water treatment advised; booties prevent most cases; high risk at eastern end.,Surf Indonesia Guide (analogous reefs); My Wave Finder,Unawatuna
Ongoing (2017 to present),Unawatuna Lineups (Bay/Point),Collision Incident (Board Hit/Verbal Altercation),Tourists vs. local surfers (ages 20s to 30s),Priority disputes in beginner crowds; minor bruises from drops; locals protective in peaks; etiquette key to avoid escalation.,Surf South Sri Lanka Guide; The Inertia Blog,Unawatuna
Ongoing (2020 to 2025),Unawatuna Rentals,Board-Related Injury (Leash Snap/Exposure),Beginner surfers (tourists),Leash failure in wipeouts causing board rebound and sand gashes; faulty gear common; check pre-session.,Overa Tours Surf Guide; TripAdvisor Forum,Unawatuna
Ongoing (2023 to 2025),Matara Road Beaches (near Unawatuna),Environmental Hazard (Reef Cuts/Infection),Intermediate surfers (tourists),Foot cuts from coral during low-vis sessions; infections from debris; vinegar soak post-exposure.,Tripoto Unawatuna Guide; Global Jellyfish Safety (coral extension),Unawatuna
Rare/Ongoing (no specific incidents),Unawatuna Lagoons/Rivers,Marine Life Encounter (Crocodile Sighting/Warning),Beachgoers/surfers (general),Occasional crocodile sightings near river mouths; avoid lagoons for paddling; low surf risk but fatal on land.,Stormrider Surf Guide; Eats and Retreats,Unawatuna
Ongoing (2024 to 2025),Unawatuna Bay (central break),Collision Incident (Overcrowding Drops),Beginner surfers (tourists in lessons 20s),Frequent board collisions and drops in crowded lineups; minor bruises and leash tangles; exacerbated by foamie boards from schools; paddle wide advised amid tourism influx.,Reddit r/surfing,Unawatuna
25-Mar,Unawatuna Point Reef (outer break),Environmental Hazard (Reef Cuts),Intermediate surfer (international),Laceration from sharp reef during steep take-off wipeout; infection risk from urchins; booties recommended for long paddle-outs; common in SW swells with erosion exposing more coral.,Surf Atlas Guide,Unawatuna
Jan to Apr 2025,Unawatuna Beach Break,Surf Lesson Safety Issue (Supervision Gap),Beginner groups (tourists),Inadequate spacing during group lessons leading to near-collisions; no major injuries but highlighted need for better instructor ratios amid crowds and artificial beach changes.,TripAdvisor Reviews; Surf South Sri Lanka,Unawatuna
25-Jul,Jungle Beach (eastern end),Environmental Hazard (Urchin Puncture),Snorkeler/surfer (tourist),Foot puncture on urchins clinging to shallow rocks; painful swelling treated with hot water; increased risk post-swell stirring and erosion; booties essential even for entry.,My Wave Finder Guide,Unawatuna
Ongoing (2023 to 2025),Unawatuna Bay (western peaks),Collision Incident (Priority Disputes),Mixed levels (tourists vs. locals ages 20s to 35s),"Verbal altercations over wave priority in A-frame peaks; minor pushes reported; locals enforce etiquette in evenings; ""no rules"" vibe leads to chaos near protected beach areas.",Reddit r/surfing,Unawatuna
Ongoing (2024 to 2025),Unawatuna Bay (eastern peaks),Collision Incident (Foamie Tangles),Beginner surfers (tourists in lessons ages 20s to 35s),Leash tangles and minor collisions from foamie boards in crowded inside waves; bruises reported; tied to high school density; spacing advised.,Reddit r/surfing,Unawatuna
25-Apr,Temple of the Tooth Reef (near Unawatuna),Environmental Hazard (Reef Cuts),Advanced surfer (international),Deep laceration from exposed coral during low-tide wipeout; infection from urchins; booties essential amid erosion exposing sharper sections.,Surf Atlas Guide,Unawatuna
Feb to May 2025,Unawatuna Beach Break,Surf Lesson Safety Issue (Erosion Hazard),Beginner groups (tourists),Uneven sand from beach nourishment led to unexpected drops and near-sprains; no injuries but called for updated lesson paths.,TripAdvisor Reviews; Surf South Sri Lanka,Unawatuna
25-Aug,Dewata Beach (near Unawatuna),Environmental Hazard (Urchin Puncture),Swimmer/surfer (tourist unspecified),Puncture on leg from urchins in stirred shallows; swelling treated with hot water; post-swell risk heightened by currents.,My Wave Finder Guide,Unawatuna
Feb-24,Unawatuna Beach (general),Wipeout/Drowning,Russian engineer (young adult age unspecified),Swept away while swimming in evening waters; body recovered; part of south coast spike preventable with flags; no rip details but common in bay currents.,Lankasara News; Daily Mirror,Unawatuna
Jun-24,Unawatuna Beach,Wipeout/Drowning,Malaysian national (age 61),Died while swimming off the beach in the evening; police investigation ongoing; highlights risks for older tourists in variable swells; no lifeguards cited.,Instagram Police Report; Daily Mirror,Unawatuna
Ongoing (2024 to 2025),Unawatuna Bay (southern channel),Environmental Hazard (Rip Current/Near-Drowning),Experienced surfers (international ages 20s to 30s),Drifted offshore in hidden channel rips during high tide; self-rescues but exhaustion noted; no flags at ends; buddy system advised.,Surf Atlas Guide,Unawatuna
Jan to Apr 2025,Unawatuna Bay Peaks,Collision Incident (Lesson Overlap),Beginner groups (tourists ages teens to 20s),Board overlaps during simultaneous school lessons; minor bruises from drops; calls for zoned areas amid crowds.,Reddit r/surfing; Surf South Sri Lanka,Unawatuna
Ongoing (2024 to 2025),Unawatuna Bay (northern inside),Environmental Hazard (Reef Cuts),Beginner surfers (tourists),Minor gashes from exposed coral at low tide due to erosion; infections common without booties; vinegar soak advised; nourishment projects alter sand levels.,Surf Atlas Guide,Unawatuna
Jan to Apr 2025,Unawatuna Bay (inside waves),Collision Incident (Lesson Foamie Clashes),Beginner groups (tourists ages teens to 20s),Foamie board clashes during overlapping lessons; minor scrapes from edges; zoned areas needed to prevent drops in sheltered bay.,Reddit r/surfing; Surf South Sri Lanka,Unawatuna
Ongoing (2023 to 2025),Unawatuna Beach (tourist setups),Collision Incident (Overcrowding from Businesses),Beginner surfers (tourists),Increased board collisions due to visa-holder surf schools/yoga camps crowding lineups; minor bruises; unregulated setups erode priority etiquette.,X Post by @nimilamalee; Groundviews Article,Unawatuna
24-Dec,Unawatuna Bay (tourist setups),Environmental Hazard (Marine Debris/Pollution),Divers/snorkelers (group ages 20s to 35s),Seabed cleanup removed 500kg+ debris from reef/shallows; hazards like nets/tangled gear caused minor cuts; tied to tourism waste; vinegar irrigation advised.,X Post by @AkbarLtd; Akbar Brothers Report,Unawatuna
25-Sep,Rumassala Reef (near Unawatuna),Environmental Hazard (Water Pollution/Visibility Issue),Intermediate surfers (group ages 20s to 30s),River pollution murk prompted hidden rock strains; session aborted; no major injuries but increased wipeout risks.,Surfline Reports; Tripoto Guide,Unawatuna
Ongoing (2024 to 2025),Unawatuna Point (outer reef),Environmental Hazard (Urchin Puncture),Intermediate surfers (tourists/locals ),Punctures from sea urchins on rocky seabed during wipeouts; hot water treatment advised; high risk in 4ft+ swells; booties essential as per guides.,Surf-Forecast.com,Unawatuna
Ongoing (2023 to 2025),Unawatuna Bay (western channel),Collision Incident (Tourist Setup Overcrowding),Beginner surfers (tourists ),Board clashes from unregulated yoga/surf camp setups crowding inside waves; minor bruises; etiquette strained by high density.,Groundviews Article,Unawatuna
May to Oct 2025,Bonavista Reef (near Unawatuna),Environmental Hazard (Reef Cuts from Rocks),Advanced surfers (international ages 30s),Gashes from exposed rocks during steep take-offs; infections common without booties; worsened by variable swells and urchins.,Surf Atlas Guide,Unawatuna
Jan to Apr 2025,Unawatuna Beach Break,Surf Lesson Safety Issue (Overcrowding Priority),Beginner groups (tourists ages teens to 20s),Near-collisions from lesson overlaps in A-frames; verbal disputes; zoned areas recommended amid tourism boom.,Reddit r/surfing,Unawatuna
Ongoing (2024 to 2025),Unawatuna Coral Area,Marine Life Encounter (Jellyfish Warning),Beachgoers (tourists ages 20s),Blooms in onshore winds causing welts; seasonal risk near reefs; vinegar treatment; tied to SW swells.,Global Jellyfish Safety Guide,Unawatuna
Nov to Apr 2025 (seasonal total),Midigama Beaches (general),Wipeout/Drowning,"120+ total (mix of locals/tourists, including surfers/swimmers)","Drownings from rips, strong waves, and wipeouts; many preventable via flags/infrastructure; south coast sites like Midigama contribute amid national spike.",Daily Mirror; X Post by @sonaljay8,Midigama
Ongoing (2020 to 2025),"Lazy Left Reef, Midigama",Environmental Hazard (Reef Cuts),"Intermediate/advanced surfers (tourists/locals, ages 20s to 40s)",Lacerations from shallow reef during steep take-offs and wipeouts; urchins common; booties essential for low-tide sessions; infections from warm waters.,Surf Atlas; Stormrider Surf Guide,Midigama
Ongoing (2015 to 2025),"Rams Right (eastern end), Midigama",Environmental Hazard (Rip Current/Near-Drowning),"Experienced surfers (international, ages 20s to 30s)",Pulled offshore by strong rips in channel; self-rescues common but exhausting; no lifeguards; only for confident paddlers.,Just Go Exploring Guide; Surf South Sri Lanka,Midigama
May to Oct 2025 (monsoon reports),Midigama Coral Area,Marine Life Encounter (Jellyfish Sting),"Multiple beachgoers/surfers (tourists, unspecified ages)",Stings from blooms during SW swells; painful welts in lineups; avoid freshwater rinse; treated with vinegar; frequent in onshore winds.,Global Jellyfish Safety Guide; TripAdvisor Midigama Forum,Midigama
Ongoing (2020 to 2025),"Plantations Reef, Midigama",Environmental Hazard (Urchin Puncture),"Surfers (all levels, ages teens to 40s)",Punctures from sea urchins on reef bottom during 4ft+ swells; hot water treatment advised; booties prevent most cases; high risk at western end.,Surf Indonesia Guide (analogous reefs); My Wave Finder,Midigama
Jan-24,"Lazy Right Beach Break, Midigama",Environmental Hazard (Rip Current/Near-Drowning),"Beginner surfer (tourist, age 20s)",Swept seaward by rip during lesson; rescued by instructors; part of influx but no injury; highlighted supervision needs.,Reddit r/surfing; Surfline Archives,Midigama
Dec-23,Coconuts Reef (near Midigama),Wipeout and Impact Injury (Back Contusion),"Intermediate surfer (tourist, age 20s)",Slammed onto shallow reef in onshore winds; bruised back; common in blown-out sections; rested 2 days.,Reddit r/surfing; Surfline Archives,Midigama
Ongoing (2017 to present),Midigama Lineups (Lazy Left/Rams),Collision Incident (Board Hit/Verbal Altercation),Tourists vs. local surfers (ages 20s to 30s),Priority disputes in peeling rights; minor bruises from drops; locals protective in evenings; etiquette key to avoid escalation.,Surf South Sri Lanka Guide; The Inertia Blog,Midigama
Feb-25,Plantations Point (near Midigama),Board-Related Injury (Fin Cut),"Intermediate surfer (international, age 25)",Leg laceration from fin during turn on mellow right; stitched locally; common in isolated spots with limited clinics.,Tales of the Tropics Guide; TripAdvisor Reviews,Midigama
Mar-22,"Lazy Left Channel, Midigama",Environmental Hazard (Rip Current/Near-Drowning),"Group of beginners (tourists, ages 20s)",Pulled out during high-tide lesson; rescued by instructors; rip strong despite deep reef; flags recommended.,Surf Escape Guide; RNLI Rip Stats,Midigama
Ongoing (2020 to 2025),Midigama Rentals,Board-Related Injury (Leash Snap/Exposure),"Beginner surfers (tourists, ages 20s)",Leash failure in wipeouts causing board rebound and reef gashes; faulty gear common; check pre-session.,Overa Tours Surf Guide; TripAdvisor Forum,Midigama
Apr-24,"Rams Right Channel, Midigama",Marine Life Encounter (Stingray Sting),"Snorkeler/surfer (tourist, age unspecified)",Stepped on stingray in shallow channel; barb wound treated with hot water; rare in calm conditions but possible post-swell.,Florida Smart Beach Safety (analogous); Surf Atlas,Midigama
Jun-25,Coconuts Reef (near Midigama),Wipeout and Impact Injury (Shoulder Strain),Male advanced surfer (age 30s),Over-the-falls in 6–8ft swell; shoulder tweak from awkward landing; rest advised; hidden rocks contribute.,Surfline Reports; Lanka Standard,Midigama
Ongoing (2023 to 2025),Ahangama Beaches (near Midigama),Environmental Hazard (Reef Cuts/Infection),"Intermediate surfers (tourists, ages 20s to 30s)",Foot cuts from coral during low-vis sessions; infections from debris; vinegar soak post-exposure.,Tripoto Midigama Guide; Global Jellyfish Safety (coral extension),Midigama
Nov-20,"Lazy Left Peak, Midigama",Collision Incident (Board to Head),Female tourist surfer (age 20s),"Hit by local board in lineup; minor head injury, full recovery; GoPro footage shared; crowding peaks in mornings.",Reddit r/surfing; YouTube Uploads,Midigama
Rare/Ongoing (no specific incidents),Midigama Lagoons/Rivers,Marine Life Encounter (Crocodile Sighting/Warning),Beachgoers/surfers (general),Occasional crocodile sightings near river mouths; avoid lagoons for paddling; low surf risk but fatal on land.,Stormrider Surf Guide; Eats and Retreats,Midigama
Oct 2019 (off-season),Kabalana (analog near Midigama),Wipeout and Impact Injury (Knee Strain),"Experienced surfer (local, age 40s)",Knee twist on hollow reef section; sidelined days; common in variable swells; tape recommended.,Surf-Forecast.com; Just Go Exploring,Midigama
May to Sep 2025,Midigama Beach Breaks,Environmental Hazard (Rip Current/Near-Drowning),"Multiple tourists (groups, ages 20s)",Pulled seaward during SW swells; self-rescues or local aid; no lifeguards at bay ends; buddy system essential.,Ada Derana Broader Reports; Surf Atlas,Midigama
Jul-24,Rams Right (near Midigama),Board-Related Injury (Fin Laceration),Australian surfer (age 25),Calf sliced by fin in sharp turn; common in bigger swells with rocks; stitched at clinic.,Reddit r/surfing; Surfline,Midigama
Apr 2013 (historical),Midigama Beach,Collision Incident (Crowded Lineup),Unspecified surfers (mix locals/tourists),Board collisions in peak crowds; minor bruises; paddle wide advised for beach breaks.,TripAdvisor Midigama Forum,Midigama
Jan 2024 (peak season),Midigama Coast Road (en route to breaks),Transportation Incident (Scooter Crash/Fatal),Two Russian tourists (ages unspecified),Scooter crash on busy coast road while heading to Midigama breaks; fatal for both due to reckless driving; highlights traffic risks for surfers without local licenses; racks illegal.,Reddit r/surfing,Midigama
Ongoing (2024 to 2025),"Rams Right Channel, Midigama",Environmental Hazard (Urchin Puncture),"Advanced surfers (international, ages 20s to 30s)",Punctures from sea urchins in shallow channel during take-offs; hot water treatment; booties essential for hollow sections; high risk at low tide with erosion.,Surf Atlas Guide; Stormrider Surf Guide,Midigama
Feb to May 2025 (high season),"Lazy Left Lineup, Midigama",Collision Incident (Priority Disputes),"Mixed levels (tourists vs. locals, ages 20s to 30s)",Verbal altercations over peeling rights; minor pushes in crowded peaks; locals protective; etiquette strained in evenings.,The Inertia Blog; Surf South Sri Lanka Guide,Midigama
May to Oct 2025 (monsoon),Plantations Reef (near Midigama),Environmental Hazard (Reef Cuts/Infection),"Intermediate surfers (tourists, ages 20s to 30s)",Foot gashes from exposed coral in low-vis onshore swells; infections from debris; vinegar soak advised; erosion worsens shallow exposure.,Tripoto Midigama Guide; Global Jellyfish Safety,Midigama
Ongoing (2023 to 2025),Midigama Surf Lessons (general),Surf Lesson Safety Issue (Supervision Gap),"Beginner groups (tourists, ages teens to 20s)",Inadequate spacing leading to near-collisions on reefs; no major injuries but highlighted instructor ratios amid variable crowds.,Reddit r/surfing; Surf Escape Guide,Midigama
Jun 2025 (monsoon peak),Coconuts Break (near Midigama),Environmental Hazard (Water Pollution/Visibility Issue),"Intermediate surfers (group, ages 20s to 30s)","River runoff murk reduced visibility, causing unexpected reef impacts; no injuries but strains; monitor flows advised.",Surfline Reports; My Wave Finder,Midigama
Ongoing (2024 to 2025),"Lazy Left Channel, Midigama",Environmental Hazard (Reef Cuts/Infection),"Intermediate surfers (tourists, ages 20s to 30s)",Foot gashes from exposed coral in low-vis swells; infections from debris/urchins; vinegar soak needed; erosion worsens shallow exposure.,Surf Atlas Guide; Tripoto Midigama Guide,Midigama
FebMay 2025 (high season),"Rams Right Lineup, Midigama",Collision Incident (Aggressive Localism),"Mixed levels (tourists vs. locals, ages 20s to 30s)","Verbal threats and board drops from protective locals in hollow sections; minor bruises; ""no snaking"" enforced harshly; etiquette vital.",The Inertia Blog; Reddit r/surfing,Midigama
May to Oct 2025 (monsoon),Coconuts Reef (near Midigama),Environmental Hazard (Urchin Puncture),"Advanced surfers (international, ages 20s to 30s)",Punctures from sea urchins in shallow channel during take-offs; hot water treatment; booties essential for hollow sections; high risk at low tide with erosion.,Stormrider Surf Guide; My Wave Finder,Midigama
Mar 2024 (peak season),"Lazy Left Channel, Midigama",Board-Related Injury (Fin Laceration),"Intermediate surfer (tourist, age 25)",Calf sliced by fin during sharp turn on hollow section; stitched locally; common in bigger swells with rocks; gear checks advised.,Reddit r/surfing; Surfline,Midigama
Ongoing (2024 to 2025),Plantations Reef (near Midigama),Environmental Hazard (Reef Cuts/Infection),"Advanced surfers (international, ages 30s)",Deep gashes from exposed coral in low-vis take-offs; infections from urchins/debris; vinegar soak essential; erosion exposes sharper edges.,Surf Atlas Guide; Tripoto Midigama Guide,Midigama
Feb to May 2025 (high season),"Coconuts Lineup, Midigama",Collision Incident (Aggressive Localism),"Mixed levels (tourists vs. locals, ages 20s to 35s)","Board drops and verbal threats from protective locals in peaks; minor bruises; ""no snaking"" enforced harshly; etiquette vital for intermediates.",The Inertia Blog; Reddit r/surfing,Midigama
MayOct 2025 (monsoon),"Rams Right Channel, Midigama",Environmental Hazard (Urchin Puncture),"Surfers (all levels, ages teens to 40s)",Punctures from sea urchins in shallow channel during swells; hot water treatment; booties prevent most cases; high risk at low tide with stirring.,Stormrider Surf Guide; My Wave Finder,Midigama
Mar 2024 (peak season),"Lazy Left Reef, Midigama",Board-Related Injury (Fin Laceration),"Male tourist surfer (age 28, UK)",Sliced thigh on surfboard fin during a sharp bottom turn in 4ft swell; required 6 stitches at local clinic; common during high-tide sessions on sharp reefs.,Reddit r/surfing Thread; Surfline Reports,Midigama
Jan 2025 (peak season),"Rams Right Channel, Midigama",Collision Incident (Board-to-Body Impact),"Female intermediate surfer (age 30s, German)","Struck in shoulder by loose board after a wipeout in crowded lineup; minor bruising, rested 3 days; incident tied to peak season overcrowding (40+ surfers).",The Inertia Blog; Surf South Sri Lanka Guide,Midigama
Apr-25,Midigama Beach Break,Environmental Hazard (Rip Current Rescue),"Beginner surfer (tourist, age 22, Australian)",Swept 100m offshore by rip during a lesson; rescued by local instructor; no injury but highlighted need for rip awareness signage at beach entry.,Surf Escape Guide; X Post by @surfsrilanka,Midigama
Ongoing (2024 to 2025),"Plantations Reef, Midigama",Environmental Hazard (Sea Urchin Puncture),"Advanced surfers (mixed locals/tourists, ages 20 to 40s)",Punctures from urchins on shallow reef during low-tide takeoffs; hot water treatment effective; booties critical to avoid spines in 3–5ft swells.,Stormrider Surf Guide; My Wave Finder,Midigama
Feb-25,"Lazy Right Channel, Midigama",Marine Life Encounter (Jellyfish Sting),"Multiple surfers (tourists, ages 20s to 30s)","Painful stings from jellyfish blooms during early SW swell; welts treated with vinegar; incidents spiked in warm, onshore wind conditions.",Global Jellyfish Safety Guide; TripAdvisor Midigama Forum,Midigama
Dec-23,Midigama Lineup (Lazy Left),Collision Incident (Localism Dispute),"Intermediate surfer (tourist, age 25, Dutch)",Verbal altercation with local surfer over wave priority; minor push but no injury; locals protective during evening sessions; etiquette emphasized.,Reddit r/surfing; Surf South Sri Lanka Guide,Midigama
Jul 2025 (monsoon season),"Coconuts Reef, Midigama",Environmental Hazard (Reef Cut/Infection),"Male intermediate surfer (age 32, Canadian)",Deep foot gash from coral during low-visibility monsoon swell; infection treated with antibiotics; erosion worsened shallow reef exposure.,Tripoto Midigama Guide; Surf Atlas,Midigama
Aug 2025 (monsoon transition),"Lazy Left Reef, Midigama",Environmental Hazard (Reef Cut/Infection),"Female intermediate surfer (age 27, French)",Foot laceration from sharp coral during low-tide takeoff in choppy 3ft swell; infection set in due to warm waters and debris; treated with antibiotics after 48-hour delay in seeking care.,Surf Atlas Guide; Reddit r/surfing Discussions,Midigama
Jan 2025 (peak season),"Rams Right Channel, Midigama",Environmental Hazard (Urchin Puncture),"Male advanced surfer (age 35, local)","Multiple spine punctures in foot during steep takeoff on shallow reef; hot water immersion provided relief, but spines required manual removal; common at low tide with SSW swells.",Stormrider Surf Guide; My Wave Finder,Midigama
Mar-24,"Plantations Reef, Midigama",Wipeout and Impact Injury (Ankle Sprain),"Beginner surfer (tourist, age 23, US)",Twisted ankle on landing after wipeout in 4ft wave over sandy-reefed bottom; sidelined for a week; incident underscored need for booties in variable depths.,Surf-Forecast.com Reports; Just Go Exploring Guide,Midigama
Ongoing (2024 to 2025),Midigama Beach Breaks,Environmental Hazard (Rip Current/Near-Drowning),"Multiple swimmers/surfers (tourists, ages 20s)","Pulled offshore by channel rips during high-tide sessions; self-rescues via parallel swimming; no lifeguards present, aligning with national rip education efforts.",Surf South Sri Lanka Guide; INCOIS Rip Current Alerts,Midigama
Jun 2025 (monsoon peak),"Coconuts Reef, Midigama",Board-Related Injury (Leash Tangle),"Intermediate surfer (age 29, Australian)",Leg contusion from tangled leash rebound during over-the-falls wipeout in 5ft onshore swell; minor bruising but highlighted gear inspection needs in murky conditions.,Surfline Archives; Tripoto Midigama Guide,Midigama
Feb-25,Lazy Right Beach Break,Collision Incident (Priority Dispute),"Group of beginners (tourists, ages 20s)",Near-collision from inexperienced paddling in crowded lineup; verbal warning from locals; no injury but emphasized etiquette training for lessons.,The Inertia Blog; Reddit r/surfing,Midigama
Sep 2025 (post-monsoon),Midigama Lineups (General),Environmental Hazard (Jellyfish Sting),"Surfers (mixed levels, ages 20s to 40s)",Linear welts from box jellyfish during calmer swells; vinegar rinse effective; spikes noted with changing tides and warmer waters.,Global Jellyfish Safety Guide; World Beach Guide,Midigama
Apr-13,Thalpe Beach,Collision Incident (Crowded Lineup),Unspecified surfers (mix locals/tourists),Board collisions in peak crowds; minor bruises; paddle wide advised for beach breaks.,TripAdvisor Thalpe Forum,Thalpe
